{
  "schema": "codex-usage-tracker.formula-contract.v1",
  "version": 1,
  "source_catalog": "config/agent-kernel/question-catalog-v1.json",
  "formulas": [
    {
      "id": "accepted_mutation_summary_v1",
      "inputs": [
        "records mutation counters"
      ],
      "fact_relations": [
        "publication",
        "publication_delta"
      ],
      "filtering": "No hidden filter is allowed inside accepted_mutation_summary_v1. Accept operands only from the exact formula_uses entry after that named plan applies typed request, capability, publication, selector, and half-open window gates; answer, oracle, and grading fields are forbidden.",
      "grouping": "Invoke accepted_mutation_summary_v1 once per deterministic output group produced by the exact formula_uses plan; group identity and input order come from canonical logical IDs and the catalog order contract, never from an emitted answer row.",
      "ordering": "No row ordering affects this scalar or fixed-key aggregation.",
      "null_empty_behavior": "Missing required measurement yields null when a measurement is unavailable; malformed operand types fail closed; empty cohorts use the operation-specific neutral/null result.",
      "numeric_types": "Signed integer counts and UTC microseconds; Decimal exact arithmetic for ratios, medians, means, and rates.",
      "rounding": "No implicit rounding or binary float conversion; Decimal precision is preserved.",
      "units": "count or named fact fields",
      "window_boundary_source": "The normalized caller cohort is bounded by its source [start_us, end_us) interval when temporal; this evaluator reads no clock or storage.",
      "result_shape": "fixed-key object",
      "operation": "evaluate_formula",
      "symbol": "accepted_mutation_summary_v1"
    },
    {
      "id": "adjacent_event_gap_v1",
      "inputs": [
        "current",
        "previous"
      ],
      "fact_relations": [
        "tool_invocation",
        "turn"
      ],
      "filtering": "No hidden filter is allowed inside adjacent_event_gap_v1. Accept operands only from the exact formula_uses entry after that named plan applies typed request, capability, publication, selector, and half-open window gates; answer, oracle, and grading fields are forbidden.",
      "grouping": "Invoke adjacent_event_gap_v1 once per deterministic output group produced by the exact formula_uses plan; group identity and input order come from canonical logical IDs and the catalog order contract, never from an emitted answer row.",
      "ordering": "No row ordering affects this scalar or fixed-key aggregation.",
      "null_empty_behavior": "Missing required measurement yields null when a measurement is unavailable; malformed operand types fail closed; empty cohorts use the operation-specific neutral/null result.",
      "numeric_types": "Signed integer counts and UTC microseconds; Decimal exact arithmetic for ratios, medians, means, and rates.",
      "rounding": "No implicit rounding or binary float conversion; Decimal precision is preserved.",
      "units": "microseconds",
      "window_boundary_source": "The normalized caller cohort is bounded by its source [start_us, end_us) interval when temporal; this evaluator reads no clock or storage.",
      "result_shape": "scalar, boolean, or null",
      "operation": "evaluate_formula",
      "symbol": "adjacent_event_gap_v1"
    },
    {
      "id": "bounded_adjacency_v1",
      "inputs": [
        "ordered records.id"
      ],
      "fact_relations": [
        "canonical_call",
        "resource",
        "tool_invocation",
        "turn"
      ],
      "filtering": "No hidden filter is allowed inside bounded_adjacency_v1. Accept operands only from the exact formula_uses entry after that named plan applies typed request, capability, publication, selector, and half-open window gates; answer, oracle, and grading fields are forbidden.",
      "grouping": "Invoke bounded_adjacency_v1 once per deterministic output group produced by the exact formula_uses plan; group identity and input order come from canonical logical IDs and the catalog order contract, never from an emitted answer row.",
      "ordering": "Record input order is semantic; equal source positions retain their supplied order.",
      "null_empty_behavior": "Missing required measurement yields null when a measurement is unavailable; malformed operand types fail closed; empty cohorts use the operation-specific neutral/null result.",
      "numeric_types": "Signed integer counts and UTC microseconds; Decimal exact arithmetic for ratios, medians, means, and rates.",
      "rounding": "No implicit rounding or binary float conversion; Decimal precision is preserved.",
      "units": "count or named fact fields",
      "window_boundary_source": "The normalized caller cohort is bounded by its source [start_us, end_us) interval when temporal; this evaluator reads no clock or storage.",
      "result_shape": "deterministically ordered object list",
      "operation": "evaluate_formula",
      "symbol": "bounded_adjacency_v1"
    },
    {
      "id": "cached_output_ratio_v1",
      "inputs": [
        "numerator",
        "denominator"
      ],
      "fact_relations": [
        "canonical_call",
        "session",
        "turn"
      ],
      "filtering": "No hidden filter is allowed inside cached_output_ratio_v1. Accept operands only from the exact formula_uses entry after that named plan applies typed request, capability, publication, selector, and half-open window gates; answer, oracle, and grading fields are forbidden.",
      "grouping": "Invoke cached_output_ratio_v1 once per deterministic output group produced by the exact formula_uses plan; group identity and input order come from canonical logical IDs and the catalog order contract, never from an emitted answer row.",
      "ordering": "No row ordering affects this scalar or fixed-key aggregation.",
      "null_empty_behavior": "Missing required measurement yields null when a measurement is unavailable; malformed operand types fail closed; empty cohorts use the operation-specific neutral/null result.",
      "numeric_types": "Signed integer counts and UTC microseconds; Decimal exact arithmetic for ratios, medians, means, and rates.",
      "rounding": "No implicit rounding or binary float conversion; Decimal precision is preserved.",
      "units": "ratio",
      "window_boundary_source": "The normalized caller cohort is bounded by its source [start_us, end_us) interval when temporal; this evaluator reads no clock or storage.",
      "result_shape": "scalar, boolean, or null",
      "operation": "evaluate_formula",
      "symbol": "cached_output_ratio_v1"
    },
    {
      "id": "cached_share_v1",
      "inputs": [
        "numerator",
        "denominator"
      ],
      "fact_relations": [
        "canonical_call",
        "compaction_boundary",
        "session",
        "turn"
      ],
      "filtering": "No hidden filter is allowed inside cached_share_v1. Accept operands only from the exact formula_uses entry after that named plan applies typed request, capability, publication, selector, and half-open window gates; answer, oracle, and grading fields are forbidden.",
      "grouping": "Invoke cached_share_v1 once per deterministic output group produced by the exact formula_uses plan; group identity and input order come from canonical logical IDs and the catalog order contract, never from an emitted answer row.",
      "ordering": "No row ordering affects this scalar or fixed-key aggregation.",
      "null_empty_behavior": "Missing required measurement yields null when a measurement is unavailable; malformed operand types fail closed; empty cohorts use the operation-specific neutral/null result.",
      "numeric_types": "Signed integer counts and UTC microseconds; Decimal exact arithmetic for ratios, medians, means, and rates.",
      "rounding": "No implicit rounding or binary float conversion; Decimal precision is preserved.",
      "units": "ratio",
      "window_boundary_source": "The normalized caller cohort is bounded by its source [start_us, end_us) interval when temporal; this evaluator reads no clock or storage.",
      "result_shape": "scalar, boolean, or null",
      "operation": "evaluate_formula",
      "symbol": "cached_share_v1"
    },
    {
      "id": "compatible_allowance_interval_v1",
      "inputs": [
        "left_provider",
        "right_provider",
        "left_limit",
        "right_limit",
        "left_plan",
        "right_plan",
        "left_window_kind",
        "right_window_kind",
        "left_reset",
        "right_reset",
        "left_observed_at_us",
        "right_observed_at_us"
      ],
      "fact_relations": [
        "allowance_observation",
        "canonical_call",
        "turn",
        "valuation_match"
      ],
      "filtering": "No hidden filter is allowed inside compatible_allowance_interval_v1. Accept operands only from the exact formula_uses entry after that named plan applies typed request, capability, publication, selector, and half-open window gates; answer, oracle, and grading fields are forbidden.",
      "grouping": "Invoke compatible_allowance_interval_v1 once per deterministic output group produced by the exact formula_uses plan; group identity and input order come from canonical logical IDs and the catalog order contract, never from an emitted answer row.",
      "ordering": "No row ordering affects this scalar or fixed-key aggregation.",
      "null_empty_behavior": "Missing required measurement yields null when a measurement is unavailable; malformed operand types fail closed; empty cohorts use the operation-specific neutral/null result.",
      "numeric_types": "Signed integer counts and UTC microseconds; Decimal exact arithmetic for ratios, medians, means, and rates.",
      "rounding": "No implicit rounding or binary float conversion; Decimal precision is preserved.",
      "units": "count or named fact fields",